{
  "$schema": "https://json-schema.org/draft/2020-12/schema",
  "$id": "https://parison.dev/schemas/time-alignment-v1.schema.json",
  "title": "Parison time alignment declaration v1",
  "type": "object",
  "required": ["alignment_version", "event_window", "coordination", "datasets"],
  "properties": {
    "alignment_version": {"const": 1},
    "event_window": {
      "type": "object",
      "required": ["start", "end", "bounds"],
      "properties": {
        "start": {"$ref": "#/$defs/timestamp"},
        "end": {"$ref": "#/$defs/timestamp"},
        "bounds": {"const": "start-inclusive-end-exclusive"}
      },
      "additionalProperties": false
    },
    "coordination": {
      "oneOf": [
        {"$ref": "#/$defs/snapshotCoordination"},
        {"$ref": "#/$defs/watermarkCoordination"},
        {"$ref": "#/$defs/cutoffCoordination"}
      ]
    },
    "datasets": {"type": "array", "minItems": 1, "items": {"type": "object"}}
  },
  "additionalProperties": false,
  "allOf": [
    {"if": {"properties": {"coordination": {"properties": {"mode": {"const": "source-snapshot"}}}}}, "then": {"properties": {"datasets": {"items": {"$ref": "#/$defs/snapshotDataset"}}}}},
    {"if": {"properties": {"coordination": {"properties": {"mode": {"const": "watermark"}}}}}, "then": {"properties": {"datasets": {"items": {"$ref": "#/$defs/watermarkDataset"}}}}},
    {"if": {"properties": {"coordination": {"properties": {"mode": {"const": "declared-cutoff"}}}}}, "then": {"properties": {"datasets": {"items": {"$ref": "#/$defs/cutoffDataset"}}}}}
  ],
  "$defs": {
    "id": {"type": "string", "pattern": "^[A-Za-z0-9][A-Za-z0-9._-]{0,127}$"},
    "digest": {"type": "string", "pattern": "^[0-9a-f]{64}$"},
    "timestamp": {"type": "string", "pattern": "^\\d{4}-\\d{2}-\\d{2}T\\d{2}:\\d{2}:\\d{2}(?:\\.\\d{1,6})?Z$"},
    "coordinationBase": {"type": "object", "required": ["mode", "claim_id", "receipt_sha256"], "properties": {"claim_id": {"$ref": "#/$defs/id"}, "receipt_sha256": {"$ref": "#/$defs/digest"}}},
    "snapshotCoordination": {"allOf": [{"$ref": "#/$defs/coordinationBase"}, {"properties": {"mode": {"const": "source-snapshot"}}}], "unevaluatedProperties": false},
    "watermarkCoordination": {"allOf": [{"$ref": "#/$defs/coordinationBase"}, {"required": ["watermark_kind", "idle_partition_policy"], "properties": {"mode": {"const": "watermark"}, "watermark_kind": {"enum": ["closed-world", "heuristic"]}, "idle_partition_policy": {"enum": ["not-applicable", "documented"]}}}], "unevaluatedProperties": false},
    "cutoffCoordination": {"allOf": [{"$ref": "#/$defs/coordinationBase"}, {"properties": {"mode": {"const": "declared-cutoff"}}}], "unevaluatedProperties": false},
    "datasetBase": {"type": "object", "required": ["id", "event_time_column"], "properties": {"id": {"$ref": "#/$defs/id"}, "event_time_column": {"$ref": "#/$defs/id"}}},
    "snapshotDataset": {"allOf": [{"$ref": "#/$defs/datasetBase"}, {"required": ["snapshot_token", "token_domain"], "properties": {"snapshot_token": {"type": "string", "minLength": 1}, "token_domain": {"$ref": "#/$defs/id"}}}], "unevaluatedProperties": false},
    "watermarkDataset": {"allOf": [{"$ref": "#/$defs/datasetBase"}, {"required": ["watermark", "allowed_lateness_seconds"], "properties": {"watermark": {"$ref": "#/$defs/timestamp"}, "allowed_lateness_seconds": {"type": "integer", "minimum": 0}}}], "unevaluatedProperties": false},
    "cutoffDataset": {"allOf": [{"$ref": "#/$defs/datasetBase"}], "unevaluatedProperties": false}
  }
}
