{"alignment_version":1,"coordination":{"claim_id":"september-close-4","mode":"source-snapshot","receipt_sha256":"aaaaaaaaaaaaaaaaaaaaaaaaaaaaaaaaaaaaaaaaaaaaaaaaaaaaaaaaaaaaaaaa"},"datasets":[{"event_time_column":"occurred_at","id":"payments","snapshot_token":"snapshot-42","token_domain":"ledger"},{"event_time_column":"occurred_at","id":"payouts","snapshot_token":"snapshot-42","token_domain":"ledger"}],"event_window":{"bounds":"start-inclusive-end-exclusive","end":"2026-10-01T00:00:00.000000Z","start":"2026-09-01T00:00:00.000000Z"}}
